ad_description,ad_last_update,air_conditioner,balcony,bath_num,built_in_wardrobe,chimney,condition,construct_date,energetic_certif,floor,garage,garden,ground_size,heating,house_id,house_type,kitchen,lift,loc_city,loc_district,loc_full,loc_neigh,loc_street,loc_zone,m2_real,m2_useful,obtention_date,orientation,price,reduced_mobility,room_num,storage_room,swimming_pool,terrace,unfurnished
"Vivienda de dos plantas con 4 habitaciones, terraza y aseo en la planta superior. En la planta baja. Cuarto de baño completo, una habitación, un comedor enorme, cocina totalmente amueblada, patio y una habitación en el patio con chimenea y alacena, la cocina comunica con local comercial que ha servido de tienda durante unos años. Si se desea amueblada el precio sería 5000€ más.",Anuncio actualizado el 7 de abril,1,0,2,0,0,segunda mano/buen estado,,no indicado,2 plantas,,0,,,82424435, Casa o chalet independiente,,,Zalamea la Real,"Calle Ancha, 25"," Calle Ancha, 25 , Zalamea la Real , El Andévalo, Huelva ",,,"El Andévalo, Huelva",120,100,2019-04-13,sur,85000,0,5,1,0,1,
"Casa de pueblo independiente en muy buen estado, situada a pie de sierra de Huelva ideal para turismo rural, senderos a zonas mineras (Peña del hierro),Características casa individual:,1 planta, 78 m2. construidos, 2 habitaciones, 1 baño, 1 salón, cocina, lavadero, patio interior.,Contacto: Manolo Tf. 609952875.",Anuncio actualizado el 7 de abril,0,0,1,0,0,segunda mano/buen estado,,no indicado,1 planta,,0,,,82475165, Casa de pueblo,,,Nerva,"Calle General Silvestre, 4"," Calle General Silvestre, 4 , Nerva , El Andévalo, Huelva ",,,"El Andévalo, Huelva",78,,2019-04-13,,42000,0,2,0,0,0,
"finca de 22875 metros con I. B. I. urbana uso residencial casa construida de 90m cuadrados, placas solares para luz y instalación agua potable deposito, arboles. frutales 50 almendros y 8 olivos 30 encinas 2 higueras. Vistas inmejorables, camino p ropio a pie de carretera, y cancela de entrada.",Anuncio actualizado el 10 de marzo,0,0,1,0,1,segunda mano/buen estado,2016,no indicado,2 plantas,,0,,,82626624, Finca rústica,,,Sanlucar de Guadiana,Urb. parcela 120," Calle rivera de la golondrina, 5 , Urb. parcela 120 , Sanlucar de Guadiana , El Andévalo, Huelva ","Calle rivera de la golondrina, 5",,"El Andévalo, Huelva",21800,,2019-04-13,norte,150000,0,3,0,0,1,
"Casa rural en la Carretera de los Dólmenes, a la entrada de El Pozuelo (Zalamea la Real). Salón comedor con chimea y cocina integrada, dos dormitorios y un baño. Lista para entrar a vivir.",Anuncio actualizado el 24 de diciembre,1,0,1,1,1,segunda mano/buen estado,,no indicado,1 planta,,0,,,82690516, Casa rural,,,Zalamea la Real,Urb. El Pozuelo," Calle de Abajo, 1 , Urb. El Pozuelo , Zalamea la Real , El Andévalo, Huelva ","Calle de Abajo, 1",,"El Andévalo, Huelva",70,60,2019-04-13,este,37200,0,2,0,0,0,
"casa amueblada muy bien conservada, con terreno grande con huerto.. . chimenea fuego a tierra, en pleno centro del pueblo, para mas información llamar. tres habitaciones una de ellas suit, con lavabo con bañera, y el otro con plato de ducha con mampara. Amueblado.",Anuncio actualizado el 7 de abril,0,0,2,0,0,segunda mano/buen estado,,,,,0,,,82839264, Chalet adosado,,,Zalamea la Real,Zalamea s/n," Zalamea s/n , Zalamea la Real , El Andévalo, Huelva ",,,"El Andévalo, Huelva",500,120,2019-04-13,,245000,0,3,0,0,1,
"Piso situado en Minas de Riotinto.,Muy luminoso, con magníficas vistas hacia la mina de la localidad.,Esta muy bien ubicado cerca del centro y del Hospital del pueblo.",Anuncio actualizado el 11 de marzo,0,1,1,1,0,segunda mano/buen estado,,en trámite,planta 4ª exterior,plaza de garaje por 6.000 eur adicionales,0,,,82932636,Piso,,1,El Campillo,"Los Cantos, 3 Bloque"," Los Cantos, 3 Bloque , El Campillo , El Andévalo, Huelva ",,,"El Andévalo, Huelva",90,,2019-04-13,,60000,0,3,1,0,1,
"Se vende casa reformada de 87 m2 en Aldea de Traslasierra (Huelva), con garaje de 28 m2 con capacidad para dos vehículos. La casa se vende amueblada y dispone de 3 habitaciones, un baño, salón comedor con chimenea, cocina nueva y terraza con barbacoa en planta superior, con excelentes vistas a la sierra de Huelva.",Anuncio actualizado el 7 de abril,0,0,1,1,1,segunda mano/buen estado,,no indicado,2 plantas,plaza de garaje incluida en el precio,0,,,82945502, Casa rural,,,El Campillo,"Calle Camino, 20"," Calle Camino, 20 , El Campillo , El Andévalo, Huelva ",,,"El Andévalo, Huelva",87,,2019-04-13,,50000,0,3,0,0,1,
"El inmueble (PISO) se encuentra situado en el municipio de Nerva (HUELVA). La vivienda está ubicada en un edificio de un edificio de dos alturas. La vivienda se distribuye en tres dormitorios, salón-comedor, cocina, un aseo.",Anuncio actualizado el 27 de marzo,0,0,1,0,0,segunda mano/buen estado,,,planta 1ª,,0,,,36530714,Piso,,0,Nerva,Calle calvario," Calle calvario , Nerva , El Andévalo, Huelva ",,,"El Andévalo, Huelva",97,,2019-04-13,,34471,0,3,0,0,0,
casa de pueblo para reformar o bien para derrumbe para nueva construccion. VIVIENDA INDIVIDUAL - Unifamiliar Adosada de 1P. de 1 planta sobre rasante.,Anuncio actualizado el 27 de marzo,0,0,1,0,0,segunda mano/buen estado,,,,,0,,,38662192, Casa o chalet independiente,,,Paymogo,Calle nueva," Calle nueva , Paymogo , El Andévalo, Huelva ",,,"El Andévalo, Huelva",65,,2019-04-13,,31768,0,1,0,0,0,
Dos casas divididas por la mitad. Con dos cocinas y chimeneas.,Anuncio actualizado el 21 de noviembre,0,0,2,0,0,segunda mano/buen estado,,no indicado,,plaza de garaje incluida en el precio,1,,,83097286, Chalet pareado,,,San Bartolomé de la Torre,"Finca Agua de Verano, 2"," Finca Agua de Verano, 2 , San Bartolomé de la Torre , El Andévalo, Huelva ",,,"El Andévalo, Huelva",8250,220,2019-04-13,,195000,0,8,1,1,1,
"Chalet independiente en la mejor zona del pueblo, junto al parque los cipreses.,Consta de tres dormitorios, dos de ellos con armarios empotrados. Baño y aseo, cocina y gran salón comedor. Gran terraza y patio que da a dos calles. Garaje y trastero. Requiere algunas reformas.",Anuncio actualizado el 17 de enero,1,0,2,1,0,segunda mano/para reformar,,no indicado,1 planta,plaza de garaje incluida en el precio,0,,,83892078, Casa o chalet independiente,,,El Campillo,"Cervantes, 122"," Cervantes, 122 , El Campillo , El Andévalo, Huelva ",,,"El Andévalo, Huelva",280,,2019-04-13,"norte, sur",155000,0,3,1,0,1,
"se vende casa, con 4 dormitorios, un baño y un salón que dispone de chimenea, aparte tiene otro salón con TV y zona de descanso. La casa está totalmente amueblada.",Anuncio actualizado el 24 de febrero,0,0,1,0,1,segunda mano/buen estado,,no indicado,1 planta,plaza de garaje incluida en el precio,0,,,84231658, Casa de pueblo,,,Villanueva de los Castillejos,"Calle Chica, 21"," Calle Chica, 21 , Villanueva de los Castillejos , El Andévalo, Huelva ",,,"El Andévalo, Huelva",180,,2019-04-13,,45000,0,4,1,0,1,
"Preciosa casa adosada a estrenar en Calañas (Huelva). Tiene 82 m2 distribuida en dos plantas. En planta inferior porche de entrada, salón-comedor, cocina con patio y aseo. En planta superior 3 dormitorios y cuarto de baño. Todo exterior. Buenas calidades.",Anuncio actualizado el 7 de abril,0,0,2,0,0,segunda mano/buen estado,,no indicado,2 plantas,,0,,,84234298, Chalet adosado,,,Calañas,"Doctor Miguel Marquez, 6"," Doctor Miguel Marquez, 6 , Calañas , El Andévalo, Huelva ",,,"El Andévalo, Huelva",82,,2019-04-13,,98000,0,3,0,0,0,
"La dirección correcta es calle Santa Clara, 1 en La Zarza (Calañas) provincia de Huelva.",Anuncio actualizado el 7 de abril,0,0,1,0,0,segunda mano/buen estado,,no indicado,,,0,,,39992383, Casa de pueblo,,,Calañas,"Calle Santa Clara, 1"," Calle Santa Clara, 1 , Calañas , El Andévalo, Huelva ",,,"El Andévalo, Huelva",69,,2019-04-13,,40000,0,2,0,0,0,
"Gran casa de dos plantas totalmente reformada en el centro del pueblo. En planta baja: recibidor, salón comedor, salita, 1 habitación, cocina, cuarto de baño, patio y lavadero. En planta alta, 3 habitaciones, salón, cuarto de baño, azotea y balcón. Entrada principal por la calle Pacífico y desde el patio se sale a la calle Castilla.",Anuncio actualizado el 7 de abril,0,1,2,1,0,segunda mano/buen estado,,no indicado,2 plantas,,0,,,84414618, Casa o chalet independiente,,,Nerva,"Calle Pacífico, 7"," Calle Pacífico, 7 , Nerva , El Andévalo, Huelva ",,,"El Andévalo, Huelva",208,,2019-04-13,sur,134000,0,4,1,0,1,
Bonita casa de pueblo totalmente amueblada con suelo porcelanico y carpinteria interior en madera. Dispone de chimenea en el salon y estufa de leña en planta alta. Esta muy bien comunicada cerca del parque de Aracena y picos de Aroche y a unos 45 min de la playa.,Anuncio actualizado el 25 de febrero,0,0,2,1,0,segunda mano/buen estado,,no indicado,,,0,,,32084669, Casa o chalet independiente,,,Minas de Riotinto,"Calle jose marquez, 3"," Calle jose marquez, 3 , Minas de Riotinto , El Andévalo, Huelva ",,,"El Andévalo, Huelva",100,,2019-04-13,oeste,53000,0,4,1,0,0,
,Anuncio actualizado el 9 de abril,0,0,2,0,0,segunda mano/para reformar,,no indicado,2 plantas,,0,,,83935383, Casa de pueblo,,,Alosno,"Calle Vallegrande, 36"," Calle Vallegrande, 36 , Alosno , El Andévalo, Huelva ",,,"El Andévalo, Huelva",100,,2019-04-13,,39000,0,4,0,0,0,
"Vendemos piso en Grupo Romero Villa, Bloque B. 1 dcha, (escuchamos ofertas).",Anuncio actualizado el 10 de abril,0,1,1,1,0,segunda mano/buen estado,,no indicado,planta 1ª exterior,,0,,,84878225,Piso,,0,Minas de Riotinto,Urb. Grupo Romero Villa," Grupo Romero Villa, 1 BloqueB , Urb. Grupo Romero Villa , Minas de Riotinto , El Andévalo, Huelva ","Grupo Romero Villa, 1 BloqueB",,"El Andévalo, Huelva",80,,2019-04-13,"este, oeste",40000,0,3,0,0,0,
"adosado en muy buen estado para entrar a vivir, cocina totalmente amueblada, sótano habitable, Aires acondicionados, ver sin compromiso. posibilidad de permuta con vivienda en moguer.",Anuncio actualizado el 23 de diciembre,1,0,1,0,0,segunda mano/buen estado,,no indicado,3 plantas,,0,,,31198275, Chalet adosado,,,Minas de Riotinto,"Calle pedro garcia mendez, 37"," Calle pedro garcia mendez, 37 , Minas de Riotinto , El Andévalo, Huelva ",,,"El Andévalo, Huelva",120,,2019-04-13,,84995,0,3,1,0,1,
"ESPECTACULAR CASA EN EL CERRO DEL ANDEVALO. Muy luminosa, y bien situada. 6 dormitorios, 2 baños (bañera y plato de ducha), 3 salones, uno de ellos con chimenea. Patio y terraza. Se vende semiamueblada. Mejor ver. Es sorprendente, de lo mejor q se puede encontrar.",Anuncio actualizado el 8 de abril,0,1,2,1,1,segunda mano/buen estado,,inmueble exento,2 plantas,,0,,,39538634, Casa de pueblo,,,El Cerro de Andévalo,"Calle Egido, 44"," Calle Egido, 44 , El Cerro de Andévalo , El Andévalo, Huelva ",,,"El Andévalo, Huelva",350,,2019-04-13,,115000,0,6,0,0,1,
"Casa adosada de dos plantas, con 3 habitaciones, 2 baños y trastero situado en la planta superior. Se encuentra ubicada dentro del núcleo urbano, próxima a centros educativos.",Anuncio actualizado el 12 de diciembre,0,0,2,0,0,segunda mano/buen estado,,,,,0,,,83540548, Chalet adosado,,,Villanueva de los Castillejos,Calle Valle Abajo," Calle Valle Abajo , Villanueva de los Castillejos , El Andévalo, Huelva ",,,"El Andévalo, Huelva",111,90,2019-04-13,,83000,0,3,1,0,0,
"Vivienda que consta de salón-comedor, cocina con salida a patio interior, 3 habitaciones, 1 aseo, 1 baño y tendedero. Situada a escasos minutos a pie del centro de la localidad, con zonas comerciales y cercano a centros educativos.",Anuncio actualizado el 20 de febrero,0,0,2,0,0,segunda mano/buen estado,,no indicado,,,0,,,84357449, Chalet adosado,,,San Bartolomé de la Torre,Calle Lepanto," Calle Lepanto , San Bartolomé de la Torre , El Andévalo, Huelva ",,,"El Andévalo, Huelva",95,80,2019-04-13,,77500,0,3,0,0,0,
"Vivienda unifamiliar adosada distribuida en dos plantas con cuatro dormitorios, jardin delantero y orientada a dos calles. Planta baja con salon comedor, cocina, aseo y un dormitorio. Planta alta con baño y tres dormitorios. Ante jardin delantero. Buen estado.",Anuncio actualizado el 27 de septiembre,0,0,2,0,0,,2009,no indicado,,,0,,,81895293, Chalet adosado,,,Tharsis,Calle Federico Garcia Lorca," Calle Federico Garcia Lorca , Tharsis , El Andévalo, Huelva ",,,"El Andévalo, Huelva",90,90,2019-04-13,,75000,0,4,0,0,0,
"Solar en bruto, preparado para su reforma integral y construccion de vivienda y/o local.",Anuncio actualizado el 17 de marzo,0,0,sin baños,0,0,segunda mano/para reformar,,no indicado,,,0,,,447999, Casa o chalet independiente,,,Minas de Riotinto,"Calle Manuel de Fallo, 45"," Calle Manuel de Fallo, 45 , Minas de Riotinto , El Andévalo, Huelva ",,,"El Andévalo, Huelva",65,,2019-04-13,sur,23500,0,sin habitación,0,0,0,
"Casa adosada distribuida en planta baja y alta, dispone de 4 habitaciones y 2 baños. Situado en una zona residencial con todo tipo de servicios y a una hora de la frontera con Portugal. No lo dudes y solicita más información.",Anuncio actualizado el 3 de enero,0,0,2,0,0,segunda mano/buen estado,,,planta 1ª exterior,plaza de garaje incluida en el precio,0,,,31694694,Estudio,,0,Puebla de Guzman,Calle sanlúcar," Calle sanlúcar , Puebla de Guzman , El Andévalo, Huelva ",,,"El Andévalo, Huelva",142,128,2019-04-13,,130100,0,sin habitación,0,0,0,
"Casa en venta en Alosno, Huelva. Dispone de una superficie de 86m² distribuidos en 2 plantas. La planta baja consta de salón-comedor, cocina a reformar, 2 habitaciones, 1 baño y 1 patio. La primera planta consta de 1 gran habitación y 1 gran terraza. Situada cerca de comercios y servicios. Con fácil acceso a la carretera H-9011.",Anuncio actualizado el 23 de febrero,0,0,1,0,0,segunda mano/buen estado,,,,,0,,,38884740, Casa o chalet independiente,,,Alosno,Calle ayamonte," Calle ayamonte , Alosno , El Andévalo, Huelva ",,,"El Andévalo, Huelva",86,,2019-04-13,,38000,0,2,0,0,0,
El inmueble (PISO) se encuentra situado en el municipio de SAN BARTOLOMÉ DE LA TORRE (HUELVA). El inmueble (PISO) se distribuye en tres habitaciones y cuatro baños.,Anuncio actualizado el 27 de marzo,0,0,4,0,0,segunda mano/buen estado,,,,,0,,,81971767,Piso,,0,San Bartolomé de la Torre,Calle el Pozo," Calle el Pozo , San Bartolomé de la Torre , El Andévalo, Huelva ",,,"El Andévalo, Huelva",133,93,2019-04-13,,83859,0,3,0,0,0,
"os, dispone de patio trasero, porche y plaza de aparcamiento. A pocos minutos de todo tipo de servicios, colegios, supermercados.",Anuncio actualizado el 4 de abril,0,0,2,0,0,segunda mano/buen estado,,,,plaza de garaje incluida en el precio,0,,,82609223, Chalet adosado,,,Villanueva de los Castillejos,Calle Cirocho," Calle Cirocho , Villanueva de los Castillejos , El Andévalo, Huelva ",,,"El Andévalo, Huelva",131,109,2019-04-13,,94000,0,4,0,0,0,
"Este casa / chalet se encuentra en Calle JOSE ECHEGARAY, 41-43, Calañas, Huelva. Es un casa / chalet que tiene 191 m2 y dispone de 1 habitaciones y 1 baños. Éste es sólo uno de los más de 30.000 inmuebles que tenemos para ti.",Anuncio actualizado el 28 de marzo,0,0,1,0,0,segunda mano/buen estado,,,,,0,,,83319411, Casa o chalet independiente,,,Calañas,Calle Jose Echegaray," Calle Jose Echegaray , Calañas , El Andévalo, Huelva ",,,"El Andévalo, Huelva",191,,2019-04-13,,84000,0,1,0,0,0,
,Anuncio actualizado el 26 de marzo,0,0,2,0,0,segunda mano/buen estado,,no indicado,2 plantas,plaza de garaje incluida en el precio,0,,,28375786, Casa de pueblo,,,Valverde del Camino,"Calle San José, 20"," Calle San José, 20 , Valverde del Camino , El Andévalo, Huelva ",,,"El Andévalo, Huelva",245,,2019-04-13,"este, oeste",140000,0,5,0,0,0,
"Casa de dos plantas en una de las calles más céntrica de Valverde del camino con dos dormitorios, dos baños reformados, salón comedor y cocina amueblada, suelos de cemento proyectado y parquet en la primera planta, paredes lisas y patio.",Anuncio actualizado el 30 de septiembre,0,0,2,0,0,segunda mano/buen estado,,en trámite,bajo,,0,,,38291814,Piso,,0,Valverde del Camino,Calle don pedro castilla," Calle don pedro castilla , Valverde del Camino , El Andévalo, Huelva ",,,"El Andévalo, Huelva",80,,2019-04-13,,57000,0,2,1,0,0,
"Financiación hasta el 100%,Este casa adosada a reformar se encuentra en Calle José Echegaray, Calañas, Huelva. Es un adosado, procedente de banco, luminoso y soleado que tiene 191 m2 y dispone de 3 habitaciones y 2 baños.,Se trata de un inmueble exterior. Tiene sótano y balcón y dispone de aseo, chimenea, suelo gres, ventanas aluminio y armarios empotrados. ,Podemos conseguir condiciones de financiación muy ventajosas. Llama ahora.",Anuncio actualizado el 11 de abril,0,1,2,1,0,segunda mano/para reformar,,en trámite,2 plantas,,0,,,83843444, Chalet adosado,,,Calañas,Calle Jose Echegaray," Calle Jose Echegaray , Calañas , El Andévalo, Huelva ",,,"El Andévalo, Huelva",191,,2019-04-13,,84000,0,3,0,0,0,
"Vivienda completamente reformada, situada en todo el centro del pueblo, . Consta de salón comedor, dos habitaciones, cocina, cuarto de baño, patio y amplia terraza, . Totalmente amueblada. Interesados llamen 656.595. 696.",Anuncio actualizado el 10 de abril,1,0,1,0,0,segunda mano/buen estado,,,,,0,,,84681392, Casa o chalet independiente,,,Minas de Riotinto,"Calle Seneca, 42"," Calle Seneca, 42 , Minas de Riotinto , El Andévalo, Huelva ",,,"El Andévalo, Huelva",70,70,2019-04-13,,75000,0,2,0,0,1,
"Vivienda de 2 plantas. En la planta baja tenemos cocina, comedor, salita, patio y aseo. En la planta alta 3 habitaciones y aseo. Financiamos hasta el 100%, consulte condiciones con su oficina Caja Rural mÃ¡s cercana. Consulte informaciÃ³n ampliada y otras ofertas en nuestro portal : http://portalinmobiliario.cajaruraldelsur.es",Anuncio actualizado el 28 de junio,0,0,2,0,0,,,,,,0,,,31495383, Chalet adosado,,,Calañas,," , Calañas , El Andévalo, Huelva ",,,"El Andévalo, Huelva",84,69,2019-04-13,,55272,0,3,0,0,0,
"Vivienda de 2 plantas. En la planta baja tenemos cocina, comedor, salita, patio y aseo. En la planta alta 3 habitaciones y aseo. Financiamos hasta el 100%, consulte condiciones con su oficina Caja Rural mÃ¡s cercana. Consulte informaciÃ³n ampliada y otras ofertas en nuestro portal : http://portalinmobiliario.cajaruraldelsur.es",Anuncio actualizado el 7 de febrero,0,0,2,0,0,,,,,,0,,,31495385, Chalet adosado,,,Calañas,," , Calañas , El Andévalo, Huelva ",,,"El Andévalo, Huelva",84,69,2019-04-13,,55510,0,3,0,0,0,
"Vivienda de 2 plantas. En la planta baja tenemos cocina, comedor, salita, patio y aseo. En la planta alta 3 habitaciones y aseo. Financiamos hasta el 100%, consulte condiciones con su oficina Caja Rural mÃ¡s cercana. Consulte informaciÃ³n ampliada y otras ofertas en nuestro portal : http://portalinmobiliario.cajaruraldelsur.es",Anuncio actualizado el 28 de junio,0,0,2,0,0,,,,,,0,,,31495387, Chalet adosado,,,Calañas,," , Calañas , El Andévalo, Huelva ",,,"El Andévalo, Huelva",84,69,2019-04-13,,55282,0,3,0,0,0,
"Se vende casa de pueblo en la aldea de La Isabel, es una amplia vivienda de mas de 400m2 con numerosas estancias, cuadras, patio con agua de aljibe, chimenea en dos de ellas, la vivienda esta para reformar, ideal para turismo rural por encontrarse en el paraje natural vía verde del Guadiana donde se podrá practicar senderismo tanto a pie como a caballo, se encuentra a dos km de la presa del Andevalo.",Anuncio actualizado el 29 de noviembre,0,0,2,0,1,segunda mano/para reformar,,inmueble exento,1 planta,,0,,,34791123, Casa de pueblo,,,El Almendro,"Lugar la Isabel, 1"," Lugar la Isabel, 1 , El Almendro , El Andévalo, Huelva ",,,"El Andévalo, Huelva",500,400,2019-04-13,"norte, sur, este, oeste",38000,0,7,1,0,0,
"! preciso chalet, ! en valverde! con dos viviendas, una arriba y planta baja! que pueden estar comunicadas o no! con piscina jardin etc...!",Anuncio actualizado el 29 de marzo,1,0,4,0,0,segunda mano/buen estado,1990,no indicado,1 planta,plaza de garaje incluida en el precio,1,,,39474741, Casa o chalet independiente,,,Valverde del Camino,," , Valverde del Camino , El Andévalo, Huelva ",,,"El Andévalo, Huelva",2400,300,2019-04-13,"sur, este",350000,0,7,0,1,1,
"Casa en bruto, a reformar.",Anuncio actualizado el 7 de abril,0,0,sin baños,0,0,segunda mano/para reformar,,no indicado,1 planta,,0,,,83629852, Casa o chalet independiente,,,Villanueva de los Castillejos,"Calle Alonso Morgado, 7"," Calle Alonso Morgado, 7 , Villanueva de los Castillejos , El Andévalo, Huelva ",,,"El Andévalo, Huelva",224,,2019-04-13,,22000,0,3,0,0,0,
"Arco Mediterranea les presenta este Magnifico Chalet en Elche Zona de Valverde-La Perleta que se compone de 4 habitaciones, 1 salón comedor, dos cocinas equipadas ( una de ellas en el exterior), 1 aseo, 2 baño, una terraza de 25m2 y un porche con mas de 60m2 en una parcela de 2050m2 con unas vistas impresionantes y a alcance de todos los servicios. Alta suministros realizada, tiene pista de Tenis, Padel, campo de fútbol, 3 piscinas comunitarias y boley. Ven a verla que te encantara!",Anuncio actualizado el 11 de abril,0,0,3,0,0,segunda mano/buen estado,,no indicado,,plaza de garaje incluida en el precio,1,,,83425317, Casa o chalet independiente,,,Valverde del Camino,," , Valverde del Camino , El Andévalo, Huelva ",,,"El Andévalo, Huelva",2050,98,2019-04-13,norte,240000,0,4,0,1,1,
Casa adosada situada en una zona reasidencial tranquila y con buenas comunicaciones.,Anuncio actualizado el 11 de abril,0,0,2,0,0,,,no indicado,,,1,,,84956028, Chalet adosado,,,Puebla de Guzman,Calle Trasera Peñas," Calle Trasera Peñas , Puebla de Guzman , El Andévalo, Huelva ",,,"El Andévalo, Huelva",1214,67,2019-04-13,,1186100,0,4,0,0,0,
Casa adosada situada en una zona reasidencial tranquila y con buenas comunicaciones.,Anuncio actualizado el 11 de abril,0,0,2,0,0,,,no indicado,,,1,,,84956035, Chalet adosado,,,Puebla de Guzman,Calle Trasera Peñas," Calle Trasera Peñas , Puebla de Guzman , El Andévalo, Huelva ",,,"El Andévalo, Huelva",1214,89,2019-04-13,,1186100,0,4,0,0,0,
Casa adosada situada en una zona reasidencial tranquila y con buenas comunicaciones.,Anuncio actualizado el 11 de abril,0,0,2,0,0,,,no indicado,,,1,,,84956052, Chalet adosado,,,Puebla de Guzman,Calle Trasera Peñas," Calle Trasera Peñas , Puebla de Guzman , El Andévalo, Huelva ",,,"El Andévalo, Huelva",1214,67,2019-04-13,,1186100,0,4,0,0,0,
Casa adosada situada en una zona reasidencial tranquila y con buenas comunicaciones.,Anuncio actualizado el 11 de abril,0,0,2,0,0,,,no indicado,,,1,,,84956053, Chalet adosado,,,Puebla de Guzman,Calle Trasera Peñas," Calle Trasera Peñas , Puebla de Guzman , El Andévalo, Huelva ",,,"El Andévalo, Huelva",1214,70,2019-04-13,,1186100,0,4,0,0,0,
Casa adosada situada en una zona reasidencial tranquila y con buenas comunicaciones.,Anuncio actualizado el 11 de abril,0,0,2,0,0,,,no indicado,,,1,,,84956075, Chalet adosado,,,Puebla de Guzman,Calle Trasera Peñas," Calle Trasera Peñas , Puebla de Guzman , El Andévalo, Huelva ",,,"El Andévalo, Huelva",1214,81,2019-04-13,,1186100,0,3,0,0,0,
Casa adosada situada en una zona reasidencial tranquila y con buenas comunicaciones.,Anuncio actualizado el 11 de abril,0,0,2,0,0,,,no indicado,,,1,,,84956154, Chalet adosado,,,Puebla de Guzman,Calle Trasera Peñas," Calle Trasera Peñas , Puebla de Guzman , El Andévalo, Huelva ",,,"El Andévalo, Huelva",1214,70,2019-04-13,,1186100,0,4,0,0,0,
Casa adosada situada en una zona reasidencial tranquila y con buenas comunicaciones.,Anuncio actualizado el 11 de abril,0,0,2,0,0,,,no indicado,,,1,,,84956158, Chalet adosado,,,Puebla de Guzman,Calle Trasera Peñas," Calle Trasera Peñas , Puebla de Guzman , El Andévalo, Huelva ",,,"El Andévalo, Huelva",1214,93,2019-04-13,,1186100,0,4,0,0,0,
Casa adosada situada en una zona reasidencial tranquila y con buenas comunicaciones.,Anuncio actualizado el 11 de abril,0,0,2,0,0,,,no indicado,,,1,,,84956183, Chalet adosado,,,Puebla de Guzman,Calle Trasera Peñas," Calle Trasera Peñas , Puebla de Guzman , El Andévalo, Huelva ",,,"El Andévalo, Huelva",1214,67,2019-04-13,,1186100,0,4,0,0,0,
Casa adosada situada en una zona reasidencial tranquila y con buenas comunicaciones.,Anuncio actualizado el 11 de abril,0,0,2,0,0,,,no indicado,,,1,,,84956192, Chalet adosado,,,Puebla de Guzman,Calle Trasera Peñas," Calle Trasera Peñas , Puebla de Guzman , El Andévalo, Huelva ",,,"El Andévalo, Huelva",1214,67,2019-04-13,,1186100,0,4,0,0,0,
Casa adosada situada en una zona reasidencial tranquila y con buenas comunicaciones.,Anuncio actualizado el 11 de abril,0,0,2,0,0,,,no indicado,,,1,,,84956224, Chalet adosado,,,Puebla de Guzman,Calle Trasera Peñas," Calle Trasera Peñas , Puebla de Guzman , El Andévalo, Huelva ",,,"El Andévalo, Huelva",1214,74,2019-04-13,,1186100,0,3,0,0,0,
Casa adosada situada en una zona reasidencial tranquila y con buenas comunicaciones.,Anuncio actualizado el 11 de abril,0,0,2,0,0,,,no indicado,,,1,,,84956250, Chalet adosado,,,Puebla de Guzman,Calle Trasera Peñas," Calle Trasera Peñas , Puebla de Guzman , El Andévalo, Huelva ",,,"El Andévalo, Huelva",1214,86,2019-04-13,,1186100,0,4,0,0,0,
Casa adosada situada en una zona reasidencial tranquila y con buenas comunicaciones.,Anuncio actualizado el 11 de abril,0,0,2,0,0,,,no indicado,,,1,,,84956281, Chalet adosado,,,Puebla de Guzman,Calle Trasera Peñas," Calle Trasera Peñas , Puebla de Guzman , El Andévalo, Huelva ",,,"El Andévalo, Huelva",1214,66,2019-04-13,,1186100,0,4,0,0,0,
Casa adosada situada en una zona reasidencial tranquila y con buenas comunicaciones.,Anuncio actualizado el 11 de abril,0,0,2,0,0,,,no indicado,,,1,,,84956283, Chalet adosado,,,Puebla de Guzman,Calle Trasera Peñas," Calle Trasera Peñas , Puebla de Guzman , El Andévalo, Huelva ",,,"El Andévalo, Huelva",1214,74,2019-04-13,,1186100,0,4,0,0,0,
