ad_description,ad_last_update,air_conditioner,balcony,bath_num,built_in_wardrobe,chimney,condition,construct_date,energetic_certif,floor,garage,garden,ground_size,heating,house_id,house_type,kitchen,lift,loc_city,loc_district,loc_full,loc_neigh,loc_street,loc_zone,m2_real,m2_useful,obtention_date,orientation,price,reduced_mobility,room_num,storage_room,swimming_pool,terrace,unfurnished
"Amplia casa de estilo inglés de 385 m² de superficie y 787 m² de parcela en Minas de Riotinto, provincia de Huelva.,La vivienda, por espacio y distribución, es ideal para una familia con hijos. Esta casa tiene tres plantas de altura y cuenta con dos salones, cuatro habitaciones, dos cuartos de baño y cocina amueblada y equipada con electrodomésticos. Además, la casa cuenta con un patio interior y armarios empotrados para optimizar tu espacio de almacenaje.,El inmueble es todo exterior. También cuenta con amplio jardín en la parte delantera y en la parte trasera posibilidad de construir una piscina y surtirla de agua de pozo, con opción también de urbanizar esa parcela trasera. Esta casa, situada en una vía de fácil acceso, tiene garaje para que puedas aparcar tu coche con comodidad. Además, por su orientación norte, es una casa que recibe el sol por las mañanas pero no es calurosa en los meses de verano.,La vivienda puedes adquirirla amueblada por un precio a negociar. Está en buen estado, lista para entrar a vivir. En cuanto a las calidades, esta casa cuenta con aire acondicionado, carpintería de PVC, paredes muy gruesas de granito que permiten un gran aislamiento, y suelo de gres. Para que te sientas más seguro en tu hogar, la puerta principal está reforzada.,Para mayor comodidad, la vivienda se encuentra muy cerca de un colegio de primaria, de formación profesional e instituto, el centro de salud, hospital y todos los servicios necesarios para el día a día. Tiene una práctica incorporación a la N-435 para llegar a Huelva y Sevilla en una hora.,Llama al 693900894 y visita esta vivienda.,h1o0u2s5e8l0l.",Anuncio actualizado el 12 de abril,1,0,2,1,0,segunda mano/buen estado,,en trámite,,plaza de garaje incluida en el precio,1,,,84860860, Casa o chalet,,,Minas de Riotinto,," , Minas de Riotinto , El Andévalo, Huelva ",,,"El Andévalo, Huelva",787,300,2019-04-13,,232750,0,4,0,0,0,
"Amplia casa de 160 m² en Paymogo, provincia de Huelva.,Esta vivienda, por su amplitud, satisface las necesidades de una familia con niños. Esta casa se distribuye en dos salomes, ocho habitaciones, dos cuartos de baño y cocina amueblada y equipada con electrodomésticos. Además, el chalet cuenta con un patio para que puedas desayunar al aire libre. También cuenta con un armario empotrado y con trastero exterior para que guardes todo aquello que necesites. Además, por su orientación este, en esta casa disfrutarás del sol por las mañanas, con unas vistas espléndidas. ,La vivienda podría quedar amueblada si se llega a un acuerdo, y está en buen estado, lista para entrar a vivir. En cuanto a las calidades, este chalet cuenta con chimenea en planta alta, carpintería de aluminio y suelo de terrazo. ,Está en una buena ubicación, a solo cinco minutos de Portugal y a poco más de una hora de HGuelva, y en Paymogo cuentas con todos los servicios necesarios para el día a día.,Llama al 693900894 y ven a visitarla, pasanos tu oferta y convierte esta vivienda en tu hogar! .,h1o0u2s3e5l8l.",Anuncio actualizado el 5 de abril,0,0,2,0,0,segunda mano/buen estado,,en trámite,,,0,,,84751705, Casa o chalet,,,Paymogo,," , Paymogo , El Andévalo, Huelva ",,,"El Andévalo, Huelva",160,140,2019-04-13,,100000,0,8,1,0,0,
ad_description,ad_last_update,air_conditioner,balcony,bath_num,built_in_wardrobe,chimney,condition,construct_date,energetic_certif,floor,garage,garden,ground_size,heating,house_id,house_type,kitchen,lift,loc_city,loc_district,loc_full,loc_neigh,loc_street,loc_zone,m2_real,m2_useful,obtention_date,orientation,price,reduced_mobility,room_num,storage_room,swimming_pool,terrace,unfurnished
"Ubicada en el centro de la Sierra de Huelva, en Cortegana, esta casa singular se inserta en el Parque Natural de la Sierra de Aracena y Picos de Aroche, uno de los espacios protegidos más destacados de la Comunidad, con bosques de encinas, alcornoques, castaños y monte bajo, por donde cursan numerosos arroyos, conformando un paisaje de extraordinaria belleza y atractivo.,El casco urbano de Cortegana, es de gran belleza en su conjunto, reúne todas las características de la arquitectura popular y en él destacan el Castillo y la Iglesia del Divino Salvador (ambos declarados Bien de Interés Cultural).,La casa data de 1950, en pleno casco urbano, de muros de piedra antiguos, sobre parcela de 700m², se reformó íntegramente en el 98.,Sus altos techos de 4,30m y amplios ventanales por toda la casa, proporcionan mucha luz y a ventilación natural. ,La entrada donde se encuentra la biblioteca, nos lleva a un distribuidor con lucernario, que da paso al salón-comedor con chimenea y a la cocina, ambos con salida al porche con barbacoa y a la piscina infinita de 15x4m² de agua caliente climatizada.,En esta planta hay además un cuarto de baño y la escalera que baja a la bodega, sótano y garaje. ,Subiendo a la planta primera tenemos tres amplios dormitorios con armarios empotrados, dos baños, el principal con ducha sauna. Con muebles de diseño y a medida. en esta planta se encuentra además el despacho con chimenea, desde donde se puede bajar por su terraza al porche y piscina.,En la segunda planta se encuentra el gimnasio con vistas espectaculares a todo el pueblo incluido el Castillo.,La bodega, en el sótano 1, es tradicional con suelo original. Lavadero y cuarto de plancha. Sala de máquinas con el robot de la piscina. ,Bajamos al sótano 2 donde está el acumulador de agua caliente y el parking para 4 coches, tiene elevador al sótano 1.,Otras características: calefacción central con radiadores, con energía solar, dispone de 6, la carpintería es de roble americano.,Se vende completamente amueblada con colección de libros antiguos,Muebles, alfombras y cortinas realizadas a medida de gran calidad.",Anuncio actualizado el 12 de abril,1,1,3,0,0,segunda mano/buen estado,1998,en trámite,,plaza de garaje incluida en el precio,1,,,85046008, Casa o chalet independiente,,,Cortegana,Calle Conde de Regla," Calle Conde de Regla , Cortegana , Sierra, Huelva ",,,"Sierra, Huelva",700,,2019-04-13,,375000,0,5,1,1,1,
,más de 5 meses sin actualizar,0,0,1,0,0,segunda mano/buen estado,,no indicado,planta 2ª exterior,,0,,,81589181,Piso,,0,Alájar,"Calle Rosales, 6"," Calle Rosales, 6 , Alájar , Sierra, Huelva ",,,"Sierra, Huelva",90,,2019-04-13,,150000,0,3,0,0,0,
,más de 5 meses sin actualizar,0,0,1,0,0,segunda mano/para reformar,,no indicado,1 planta,,0,,,82482150, Casa o chalet independiente,,,Santa Olalla del Cala,"Calle Blas Infante, 48"," Calle Blas Infante, 48 , Santa Olalla del Cala , Sierra, Huelva ",,,"Sierra, Huelva",250,,2019-04-13,,85000,0,3,0,0,0,
,más de 5 meses sin actualizar,0,0,1,0,0,segunda mano/buen estado,,no indicado,,,0,,,82490936, Finca rústica,,,Alájar,Calle alajar s/n," Calle alajar s/n , Alájar , Sierra, Huelva ",,,"Sierra, Huelva",9000,,2019-04-13,,250000,0,2,0,0,0,
,más de 5 meses sin actualizar,0,0,2,0,0,segunda mano/buen estado,,en trámite,2 plantas,,0,,,38024957, Casa de pueblo,,,Castaño del Robledo,"Calle Talero, 3"," Calle Talero, 3 , Castaño del Robledo , Sierra, Huelva ",,,"Sierra, Huelva",100,,2019-04-13,,130000,0,3,1,0,0,
,más de 5 meses sin actualizar,0,0,5,1,1,segunda mano/buen estado,,en trámite,3 plantas,plaza de garaje incluida en el precio,1,,,38121913, Casa de pueblo,,,Galaroza,"Calle Doctor Gumersindo Marquez, 6"," Calle Doctor Gumersindo Marquez, 6 , Galaroza , Sierra, Huelva ",,,"Sierra, Huelva",379,,2019-04-13,,379000,0,5,1,1,1,
,más de 5 meses sin actualizar,0,0,1,0,0,segunda mano/buen estado,,no indicado,,,0,,,36815331, Casa de pueblo,,,Aracena,"Calle la Esperanza, 15"," Calle la Esperanza, 15 , Aracena , Sierra, Huelva ",,,"Sierra, Huelva",75,,2019-04-13,,95000,0,2,0,0,0,
,más de 5 meses sin actualizar,1,0,2,0,0,segunda mano/buen estado,,no indicado,2 plantas,,1,,,37735302, Chalet adosado,,,Galaroza,"Avenida de los Carpinteros, 34"," Avenida de los Carpinteros, 34 , Galaroza , Sierra, Huelva ",,,"Sierra, Huelva",100,,2019-04-13,sur,110000,0,3,0,1,0,
,más de 5 meses sin actualizar,0,0,1,0,0,segunda mano/para reformar,,no indicado,,,0,,,38439902, Casa de pueblo,,,Santa Olalla del Cala,"Calle España, 20"," Calle España, 20 , Santa Olalla del Cala , Sierra, Huelva ",,,"Sierra, Huelva",272,,2019-04-13,,63000,0,7,0,0,0,
,más de 5 meses sin actualizar,0,0,1,0,0,segunda mano/buen estado,,no indicado,,,0,,,28619705, Casa o chalet independiente,,,Aroche,"Calle Senabra, 12"," Calle Senabra, 12 , Aroche , Sierra, Huelva ",,,"Sierra, Huelva",60,55,2019-04-13,,25000,0,2,0,0,0,
,más de 5 meses sin actualizar,0,0,1,0,0,segunda mano/buen estado,,no indicado,2 plantas,,0,,,81940158, Casa de pueblo,,,Encinasola,"Calle San Andrēs, 46"," Calle San Andrēs, 46 , Encinasola , Sierra, Huelva ",,,"Sierra, Huelva",80,,2019-04-13,,52000,0,3,0,0,0,
,más de 5 meses sin actualizar,0,0,1,0,0,segunda mano/buen estado,,no indicado,planta 1ª exterior,,0,,,82616159,Piso,,0,Cortegana,"Calle Jesus Nazareno, 35"," Calle Jesus Nazareno, 35 , Cortegana , Sierra, Huelva ",,,"Sierra, Huelva",70,,2019-04-13,,58900,0,2,1,0,1,
,más de 5 meses sin actualizar,0,0,1,0,0,segunda mano/para reformar,,no indicado,,,0,,,82855679, Casa de pueblo,,,Campofrio,"Agustin Mora, 3"," Agustin Mora, 3 , Campofrio , Sierra, Huelva ",,,"Sierra, Huelva",115,,2019-04-13,,48000,0,3,0,0,0,
"A tan solo 1 hora de Huelva y de Sevilla podrá encontrar esta MAGNFICA CASA SEÑORIAL DEL SIGLO XX, en pleno centro de Aracena. La casa se encuentra dividida en dos viviendas. Se encuentra en buen estado aún siendo una casa antigüa.",más de 5 meses sin actualizar,0,0,4,0,0,segunda mano/para reformar,,no indicado,4 plantas,,0,,,37008705, Casa o chalet independiente,,,Aracena,"Calle Rosal, 8"," Calle Rosal, 8 , Aracena , Sierra, Huelva ",,,"Sierra, Huelva",310,,2019-04-13,sur,190000,0,12,1,0,1,
patio.,más de 5 meses sin actualizar,0,0,3,0,0,segunda mano/buen estado,,no indicado,2 plantas,,0,,,38439968, Chalet adosado,,,Santa Olalla del Cala,"Calle Cervantes, 6"," Calle Cervantes, 6 , Santa Olalla del Cala , Sierra, Huelva ",,,"Sierra, Huelva",122,,2019-04-13,,85000,0,4,1,0,0,
Patio.,más de 5 meses sin actualizar,0,0,1,0,0,segunda mano/para reformar,,no indicado,2 plantas,,0,,,38440021, Chalet adosado,,,Santa Olalla del Cala,"Calle Cervantes, 8"," Calle Cervantes, 8 , Santa Olalla del Cala , Sierra, Huelva ",,,"Sierra, Huelva",99,,2019-04-13,,55000,0,2,1,0,0,
"es una casita muy pequeña de una aldea en la sierra, ideal para hacer una casita de finde semana para 4 personas, necesita reforma, bien orientada, zona muy tranquila y con vistas al campo, posibilidad de subir otra planta, poseo una anteproyecto, la ob$1! a saldria barata xq son pocos metros., distribución:, 1 vecinos en el edificio, la casa dispone de:,portero automático.",más de 5 meses sin actualizar,0,0,1,0,0,segunda mano/para reformar,,no indicado,bajo exterior,,0,,,1806968,Estudio,,0,Santa Ana la Real,"Calle Valde Muñoz, 13"," Calle Valde Muñoz, 13 , Santa Ana la Real , Sierra, Huelva ",,,"Sierra, Huelva",30,,2019-04-13,"sur, oeste",18000,0,sin habitación,0,0,0,
"OPORTUNIDAD  buen precio, Casa en la sierra de Aracena cerca de jabugo. Tiene 168 m2, de los cuales 80 son de la casa y lo demás patio con puerta trasera. El precio es a negociar.",más de 5 meses sin actualizar,0,0,1,0,0,segunda mano/para reformar,,no indicado,1 planta,,0,,,35017261, Casa de pueblo,,,Encinasola,"Calle de moisés Cordero, 20"," Calle de moisés Cordero, 20 , Encinasola , Sierra, Huelva ",,,"Sierra, Huelva",168,80,2019-04-13,,30000,0,4,1,0,0,
"Narciso Suárez, 59. Casita junto a la Iglesia de Cumbres Mayores. Calle muy soleada. Se le puede edificar otra planta.,Tiene instalación de agua y luz funcionando a bajo coste.",más de 5 meses sin actualizar,0,0,1,0,0,segunda mano/para reformar,,no indicado,1 planta,,0,,,38002867, Casa de pueblo,,,Cumbres Mayores,"Calle Narciso Suarez, 59"," Calle Narciso Suarez, 59 , Cumbres Mayores , Sierra, Huelva ",,,"Sierra, Huelva",28,22,2019-04-13,,5500,0,1,0,0,0,
,más de 5 meses sin actualizar,0,0,2,0,0,segunda mano/buen estado,,no indicado,,,0,,,28315636, Casa de pueblo,,,Galaroza,"Calle Alvaro de Castilla, 8"," Calle Alvaro de Castilla, 8 , Galaroza , Sierra, Huelva ",,,"Sierra, Huelva",120,100,2019-04-13,,100000,0,4,0,0,0,
,más de 5 meses sin actualizar,1,1,2,1,0,segunda mano/buen estado,,no indicado,2 plantas,,0,,,28468635, Chalet adosado,,,Cortegana,Urb. Sierra luz," Sierra Luz, 9 , Urb. Sierra luz , Cortegana , Sierra, Huelva ","Sierra Luz, 9",,"Sierra, Huelva",120,110,2019-04-13,"sur, oeste",110000,0,3,1,0,1,
,más de 5 meses sin actualizar,0,0,2,0,0,segunda mano/buen estado,,no indicado,2 plantas,,0,,,33286006, Chalet adosado,,,Cañaveral de Leon,"Calle cristóbal colón, 13 b"," Calle cristóbal colón, 13 b , Cañaveral de Leon , Sierra, Huelva ",,,"Sierra, Huelva",150,130,2019-04-13,,85000,0,3,0,0,0,
,más de 5 meses sin actualizar,0,0,2,1,0,segunda mano/buen estado,,no indicado,2 plantas,,0,,,27082505, Chalet adosado,,,Arroyomolinos de Leon,"Poeta Amador Galvan, 17"," Poeta Amador Galvan, 17 , Arroyomolinos de Leon , Sierra, Huelva ",,,"Sierra, Huelva",100,72,2019-04-13,este,83000,0,2,0,0,1,
,más de 5 meses sin actualizar,0,0,2,0,1,segunda mano/buen estado,,no indicado,1 planta,plaza de garaje incluida en el precio,0,,,81225268, Casa rural,,,Aroche,Calle los andreses s/n," Calle los andreses s/n , Aroche , Sierra, Huelva ",,,"Sierra, Huelva",600,,2019-04-13,,100000,0,3,1,0,1,
,más de 5 meses sin actualizar,0,0,1,0,0,segunda mano/para reformar,,no indicado,2 plantas,,0,,,81280794, Casa de pueblo,,,Cortegana,"Calle Sevilla, 45"," Calle Sevilla, 45 , Cortegana , Sierra, Huelva ",,,"Sierra, Huelva",100,,2019-04-13,,60000,0,5,0,0,0,
,más de 5 meses sin actualizar,0,0,1,0,0,segunda mano/buen estado,,no indicado,2 plantas,,0,,,81602868, Casa de pueblo,,,Encinasola,"Calle González Bravo, 17"," Calle González Bravo, 17 , Encinasola , Sierra, Huelva ",,,"Sierra, Huelva",165,,2019-04-13,,66000,0,4,0,0,0,
,más de 5 meses sin actualizar,0,1,2,0,0,segunda mano/buen estado,,,,plaza de garaje incluida en el precio,0,,,81626210, Chalet adosado,,,Alájar,"Avenida Del cachón, 20"," Avenida Del cachón, 20 , Alájar , Sierra, Huelva ",,,"Sierra, Huelva",150,,2019-04-13,,180000,0,5,1,0,1,
,más de 5 meses sin actualizar,0,0,1,0,0,segunda mano/buen estado,,no indicado,1 planta,plaza de garaje incluida en el precio,0,,,82365254, Casa de pueblo,,,Cumbres Mayores,"Calle Puebla de Farnals, 15"," Calle Puebla de Farnals, 15 , Cumbres Mayores , Sierra, Huelva ",,,"Sierra, Huelva",185,,2019-04-13,,80000,0,3,1,0,1,
,más de 5 meses sin actualizar,0,0,1,0,0,segunda mano/buen estado,,no indicado,,,0,,,82631717, Chalet adosado,,,Higuera de la Sierra,"Calle Larga, 22"," Calle Larga, 22 , Higuera de la Sierra , Sierra, Huelva ",,,"Sierra, Huelva",180,,2019-04-13,,80000,0,3,0,0,0,
,más de 5 meses sin actualizar,0,0,2,0,0,segunda mano/buen estado,,no indicado,,,0,,,28752828, Chalet adosado,,,Cañaveral de Leon,"Calle Olivo, 8"," Calle Olivo, 8 , Cañaveral de Leon , Sierra, Huelva ",,,"Sierra, Huelva",110,,2019-04-13,,85000,0,3,0,0,0,
,más de 5 meses sin actualizar,0,0,4,0,0,segunda mano/buen estado,,no indicado,,plaza de garaje incluida en el precio,0,,,82856056, Casa o chalet independiente,,,Jabugo,"Calle Marques de Aracena, 19"," Calle Marques de Aracena, 19 , Jabugo , Sierra, Huelva ",,,"Sierra, Huelva",364,,2019-04-13,,350000,0,4,1,0,1,
"casa amplia.,nave de 40 metros incluida.,Se vende amueblada.,precio negociable.,cocina.,dos cuartos de baño. uno en cada planta.,chimenea.,dos salones.",más de 5 meses sin actualizar,0,0,2,0,0,segunda mano/buen estado,,no indicado,2 plantas,plaza de garaje incluida en el precio,0,,,31907057, Chalet adosado,,,Cortegana,"puerto lucía, 31"," puerto lucía, 31 , Cortegana , Sierra, Huelva ",,,"Sierra, Huelva",180,140,2019-04-13,,90000,0,4,0,0,1,
"Se puede alquilar por temporadas, 450 euros al mes. La finca tiene alcornoques castaños y pinos, la situación y el acceso son inmejorables. a 2 km de fuenteheridos, las vistas desde la finca son maravillosas. la casa es totalmente nueva y el proyecto está aprobado por el parque. el pozo también está legalizado., la casa dispone de:,portero automático.",más de 5 meses sin actualizar,0,0,1,1,0,segunda mano/buen estado,,no indicado,2 plantas,plaza de garaje incluida en el precio,1,,,1928646, Casa o chalet independiente,,,Galaroza,"Carretera Navahermosa, 1"," Carretera Navahermosa, 1 , Galaroza , Sierra, Huelva ",,,"Sierra, Huelva",23500,50,2019-04-13,"sur, oeste",130000,0,2,0,0,0,
"la casa dispone de:,portero automático.",más de 5 meses sin actualizar,0,0,1,0,0,segunda mano/buen estado,,no indicado,1 planta,,0,,,2069030, Chalet adosado,,,Aracena,"Calle la Esperanza, 30"," Calle la Esperanza, 30 , Aracena , Sierra, Huelva ",,,"Sierra, Huelva",80,75,2019-04-13,,100000,0,2,0,0,0,
"Casa situada en calle Hermanos Pinzón nº 6. La casa dispone de 2 plantas, la planta baja y una altura con doblado, la planta baja consta de 2 dormitorios, 1 baño, 1 salón y una gran cocina con despensa, en la cual en el techo aun existe una cúpula del antiguo convento, la planta de arriba tiene un doblado con terraza. Casa muy centrica, en el cual estan cerca los bancos, colegio, comercios, lugar muy acogedor y tranquilo.",más de 5 meses sin actualizar,0,0,1,0,0,segunda mano/para reformar,,no indicado,1 planta,,0,,,28954007, Casa de pueblo,,,Cumbres Mayores,"Calle Hermanos Pinzon, 6"," Calle Hermanos Pinzon, 6 , Cumbres Mayores , Sierra, Huelva ",,,"Sierra, Huelva",59,,2019-04-13,sur,15000,0,2,0,0,0,
"Piso en el centro de Cortegana. 2 dormitorios con armarios empotrados, cuarto de estudio y dos cuartos de baño. Amplia azotea y trastero.",más de 5 meses sin actualizar,0,0,2,1,0,segunda mano/buen estado,,no indicado,planta 2ª interior,,0,,,29270262,Piso,,0,Cortegana,"Calle Centro, 26"," Calle Centro, 26 , Cortegana , Sierra, Huelva ",,,"Sierra, Huelva",95,,2019-04-13,,120000,0,3,0,0,0,
"Magnifica vivienda de ciento veinte metros cuadrados con Cuatro dormitorios. Salón con chimenea, una gran cocina, Dos cuartos de baño y un patio en la Sierra norte de Huelva en el Pueblo de Arroyomolinos de León. A 100 Km. De Sevilla.",más de 5 meses sin actualizar,1,0,2,1,0,segunda mano/buen estado,,,1 planta,,0,,,32765573, Chalet pareado,,,Arroyomolinos de Leon,"Urb. Arroyomolino de León, Calle Extremadura trasera"," Calle extremadura trasera, 2 , Urb. Arroyomolino de León, Calle Extremadura trasera , Arroyomolinos de Leon , Sierra, Huelva ","Calle extremadura trasera, 2",,"Sierra, Huelva",120,120,2019-04-13,norte,120000,0,4,0,0,0,
Primera planta con dos balcones exteriores. Esta pegado a la plaza principal del pueblo pero en una calle muy tranquila. Hay un piso contiguo de 79 metros cuadrado que también esta en venta. Con una obra se podría hacer un amplio piso de 150 m el importe total sería de 110.000€.,más de 5 meses sin actualizar,0,0,1,1,0,segunda mano/buen estado,,en trámite,,,0,,,34547513, Casa de pueblo,,,Cortegana,"Calle cervantes, 7"," Calle cervantes, 7 , Cortegana , Sierra, Huelva ",,,"Sierra, Huelva",78,70,2019-04-13,,70000,0,3,0,0,1,
"La planta baja tiene 3 habitaciones. La casa posee 3 cuerpos con un recibidor, una cocina y un cuarto de baño. A parte tiene un pajero y un corral con gallinero. La segunda planta esta diáfana y preparada. A parte posee un huerto muy grande con pozo. Y unas bonitas vistas a la sierra de picos de Aroche.",más de 5 meses sin actualizar,0,0,1,0,1,segunda mano/buen estado,,no indicado,2 plantas,,0,,,35296838, Casa de pueblo,,,Encinasola,"Calle Fuerte, 9"," Calle Fuerte, 9 , Encinasola , Sierra, Huelva ",,,"Sierra, Huelva",190,,2019-04-13,,50000,0,3,0,0,0,
"Aroche, Los Bravos, 2º, 160 m2, 3 habitaciones, 1 baños, jardín, terraza, Piscina, Amueblado, Electrodomésticos, Lavadora, Microondas, Nevera, Parking, TV, Se vende: Casa Rural en Los Bravos. Parque Natural? Sierra de Aracena y Picos de Aroche? (Huelva) 160 m2. Piscina y 400 m2 de terrazas Interesados contactar en: http casarurallosbravos.",más de 5 meses sin actualizar,0,0,1,0,0,segunda mano/buen estado,,no indicado,2 plantas,plaza de garaje incluida en el precio,0,,,35297265, Chalet adosado,,,Aroche,"Aldea los Bravos, 1"," Aldea los Bravos, 1 , Aroche , Sierra, Huelva ",,,"Sierra, Huelva",500,,2019-04-13,,160000,0,3,1,0,1,
"Se alquila también por fines de semana, semanas completas, puentes o largas temporadas. Consultar precios ya que varían en función de la temporada. La casa está situada en una pequeña aldea, con mucho encanto, llamada Canaleja, dentro del parque natural sierra de Aracena y picos de aroche, ven a descubrirla, querrás volver.",más de 5 meses sin actualizar,0,0,1,0,0,segunda mano/buen estado,,no indicado,1 planta,,0,,,27114113, Casa o chalet independiente,,,Almonaster la Real,"Calle Canaleja, 23"," Calle Canaleja, 23 , Almonaster la Real , Sierra, Huelva ",,,"Sierra, Huelva",98,,2019-04-13,,90000,0,2,1,0,0,
"Casa adosada de 250 m2, para entrar a vivir, 5 habitaciones, 2 baños, 2 plazas de parquing, trastero, cocina equipada, la casa tiene entrada a dos calles.",más de 5 meses sin actualizar,0,0,2,0,0,segunda mano/buen estado,,no indicado,2 plantas,plaza de garaje incluida en el precio,0,,,1675422, Chalet pareado,,,Encinasola,"Calle Altozano, 43"," Calle Altozano, 43 , Encinasola , Sierra, Huelva ",,,"Sierra, Huelva",150,,2019-04-13,"sur, este",85000,0,5,1,0,0,
"SE VENDE O ALQUILA, EN PLENA SIERRA DE HUELVA ( CAMPOFRIO ) Casa de 2 plantas mas buhardilla, 4 habitaciones, 2 cuartos de baño, garaje y patio trasero con acceso a parcela. Cuenta tambien con chimenea y piscina comunitaria. Totalmente amueblado. Su precio de venta es 110.000 euros y de alquiler 350 euros/mes.",más de 5 meses sin actualizar,0,0,2,0,0,segunda mano/buen estado,,no indicado,3 plantas,plaza de garaje incluida en el precio,1,,,29105017, Chalet adosado,,,Campofrio,"Calle Linderos de Campo Alto, 17"," Calle Linderos de Campo Alto, 17 , Campofrio , Sierra, Huelva ",,,"Sierra, Huelva",40,,2019-04-13,,70000,0,4,1,1,1,
"Casa con corral junto a la plaza principal del pueblo en Rosal de la Frontera.,El corral contiene dos higueras y un pozo.",más de 5 meses sin actualizar,0,0,1,0,0,segunda mano/para reformar,,no indicado,2 plantas,,1,,,37912737, Casa o chalet independiente,,,Rosal de la Frontera,"Calle de Juan Maraver, 44"," Calle de Juan Maraver, 44 , Rosal de la Frontera , Sierra, Huelva ",,,"Sierra, Huelva",150,155,2019-04-13,,72000,0,4,0,0,0,
Precio negociable.,más de 5 meses sin actualizar,0,0,2,0,0,segunda mano/buen estado,,no indicado,planta 1ª exterior,,0,,,37992557,Piso,,0,Aracena,"Avenida Portugal, 27"," Avenida Portugal, 27 , Aracena , Sierra, Huelva ",,,"Sierra, Huelva",90,,2019-04-13,,117500,0,3,0,0,1,
"Casa en el centro de Encinasola, parcialmente reformada, 400m2 aproximados entre casa y patio. También con antiguas caballerizas. Precio a convenir.",más de 5 meses sin actualizar,0,0,1,0,0,segunda mano/buen estado,,no indicado,,,0,,,38066533, Casa de pueblo,,,Encinasola,"Calle Arràbal Mayor, 33"," Calle Arràbal Mayor, 33 , Encinasola , Sierra, Huelva ",,,"Sierra, Huelva",200,,2019-04-13,,115000,0,4,1,0,0,
"Casa de dos plantas en el centro del pueblo, con bonitas vistas y buena ventilación.,Consta de tres dormitorios un salón, una salita, cocina, baño y una pequeña despensa.",más de 5 meses sin actualizar,1,0,1,0,0,segunda mano/buen estado,,,2 plantas,,0,,,39140938, Casa o chalet independiente,,,Aroche,"Calle de los Arcos, 9"," Calle de los Arcos, 9 , Aroche , Sierra, Huelva ",,,"Sierra, Huelva",75,,2019-04-13,,24000,0,3,0,0,0,
"Casa Rustica en Alájar, Centrica, con garaje contiguo, dos plantas, 4 habitaciones, dos salas, baño, cocina, trastero, Desván y Bodega, esta sin reformar, pero lista para habitar, luminosa, con vistas y un amplio garaje.",más de 5 meses sin actualizar,0,0,1,0,0,segunda mano/buen estado,,no indicado,2 plantas,plaza de garaje incluida en el precio,0,,,40486464, Casa de pueblo,,,Alájar,"Calle Pintor Antonio Milla, 10"," Calle Pintor Antonio Milla, 10 , Alájar , Sierra, Huelva ",,,"Sierra, Huelva",180,,2019-04-13,,85000,0,4,1,0,1,
"Casa céntrica de pueblo en plena sierra de Huelva vistas preciosa, necesita alguna reforma Agustí del comprador.",más de 5 meses sin actualizar,0,0,1,0,0,segunda mano/buen estado,,no indicado,1 planta,,0,,,81194324, Casa de pueblo,,,Cumbres de San Bartolomé,"Calle Ave Maria, 14"," Calle Ave Maria, 14 , Cumbres de San Bartolomé , Sierra, Huelva ",,,"Sierra, Huelva",120,80,2019-04-13,norte,24000,0,1,1,0,0,
"Casa en el corazón de la sierra de aracena. Valdelarco ofrece tranquilidad, precioso paisaje, buena acogida por parte de sus habitantes, calidad de vida, y un entorno entrañable. La casa tiene un dormitorio, un baño, salón comedor y cocina. Precio negociable. Contacto pedro 611406759.",más de 5 meses sin actualizar,0,0,1,0,0,segunda mano/buen estado,,no indicado,1 planta,,0,,,81248310, Casa de pueblo,,,Valdelarco,"HERMOSA, 20"," HERMOSA, 20 , Valdelarco , Sierra, Huelva ",,,"Sierra, Huelva",60,,2019-04-13,,28000,0,1,0,0,0,
