ad_description,ad_last_update,air_conditioner,balcony,bath_num,built_in_wardrobe,chimney,condition,construct_date,energetic_certif,floor,garage,garden,ground_size,heating,house_id,house_type,kitchen,lift,loc_city,loc_district,loc_full,loc_neigh,loc_street,loc_zone,m2_real,m2_useful,obtention_date,orientation,price,reduced_mobility,room_num,storage_room,swimming_pool,terrace,unfurnished
"Casa ideal para reformar de 87 m2 en Minas de Tharsis. Situado en el corazÃ³n de la comarca del AndÃ©valo, se encuentra a 30 minutos de la sierra onubense y a 30 minutos de la playa. Esta distribuido por salÃ³n comedor, cocina, lavadero, baÃ±o y 2 dormitorios. Cuenta con un garaje independiente frente a la vivienda de 40 m2 Financiamos hasta el 100%, consulte condiciones con su oficina Caja Rural mÃ¡s cercana. Consulte informaciÃ³n ampliada y otras ofertas en nuestro portal : http://portalinmobiliario.cajaruraldelsur.es",Anuncio actualizado el 4 de enero,0,0,1,0,0,,,,,,0,,,25688217, Chalet adosado,,,Tharsis,," , Tharsis , El Andévalo, Huelva ",,,"El Andévalo, Huelva",108,87,2019-04-13,,32799,0,2,0,0,0,
"Casa adosada con 3 habitaciones en el municipio de Minas de Tharsis, provincia de Huelva en la calle RAMON CAJAL.",Anuncio actualizado el 27 de febrero,0,0,1,0,0,,,,,,0,,,39022049, Chalet adosado,,,Tharsis,Calle ramon y cajal s/n," Calle ramon y cajal s/n , Tharsis , El Andévalo, Huelva ",,,"El Andévalo, Huelva",75,62,2019-04-13,,21550,0,3,0,0,0,
"Casa adosada con 3 habitaciones en la provincia de Huelva, en el municipio de Valverde del camino, en la calle DON FRANCISCO ROMERO.",Anuncio actualizado el 21 de febrero,0,0,2,0,0,,,,,,0,,,81907003, Chalet adosado,,,Valverde del Camino,Calle Don Francisco Romero s/n," Calle Don Francisco Romero s/n , Valverde del Camino , El Andévalo, Huelva ",,,"El Andévalo, Huelva",140,,2019-04-13,,91000,0,3,0,0,0,
"SIN COMISIONES DE AGENCIA,CASA DE PUEBLO. NECESITA REFORMAS,Nuestro equipo le asesorará gratis sobre las posibilidades de financiación. No te lo pienses más y llámanos. Conoce todas nuestras viviendas pinchando en el logo.,REF: 1065273/1.",Anuncio actualizado el 9 de abril,0,0,1,0,0,segunda mano/para reformar,,no indicado,,,0,,,82158120, Casa de pueblo,,,Nerva,"Calle Marqués de Nerva, 61"," Calle Marqués de Nerva, 61 , Nerva , El Andévalo, Huelva ",,,"El Andévalo, Huelva",40,,2019-04-13,,20000,0,1,0,0,0,
"Casa en la provincia de Huelva, en el municipio de Nerva, en la calle CALLE AUGUSTO.",Anuncio actualizado el 26 de enero,0,0,2,0,0,,,,,,0,,,36471580, Casa o chalet,,,Nerva,Calle Augusto s/n," Calle Augusto s/n , Nerva , El Andévalo, Huelva ",,,"El Andévalo, Huelva",103,,2019-04-13,,32750,0,3,0,0,0,
"'Se vende bonita finca de 10.402m2 completamente vallada, se trata de una tierra llana y muy cuadrada, con casa con chimenea y almacén construidos, que hacen un total de 130m2 a reformar, con luz y pozo en un entorno privilegiado en el que poder disfrutar en familia de la naturaleza, no dejes escapar esta oportunidad única de hacerse con una casa de campo a un precio único. Terreno o pie de carretera A-495 (Gibraleón - San Bartolomé). '.",Anuncio actualizado el 11 de abril,0,0,sin baños,0,0,segunda mano/para reformar,,en trámite,1 planta,,0,,,84727166, Finca rústica,,,San Bartolomé de la Torre,Calle Gibraleon," Calle Gibraleon , San Bartolomé de la Torre , El Andévalo, Huelva ",,,"El Andévalo, Huelva",10402,,2019-04-13,,65000,0,1,0,0,0,
Instalaccion electrica nueva segun normativa. total mente amueblado. colchones nuevos. cocina totalmente equipada. todas habitaciones con luz y vistas a la montaña. tres habitaciones. aire acondicionado. colejio a 30 metros. supermercados a la puerta de casa. todos papeles en regla demostrables antes de compra. sin gastos de comunidad. precio algo negociable. ventanas con mosquiteras estores y cortinas. en definitiva para entrar a vivir sin ningun tipo de reformas a realizar. urge vender. una autentica oportunidad.,Anuncio actualizado el 7 de abril,1,0,1,0,0,segunda mano/buen estado,,no indicado,planta 1ª exterior,,0,,,439019,Piso,,0,Nerva,"Barriada San José Obrero, 7"," Barriada San José Obrero, 7 , Nerva , El Andévalo, Huelva ",,,"El Andévalo, Huelva",55,,2019-04-13,,21999,0,2,0,0,0,
"Urbanizacion agua de verano n4. parcela de 6. 153 m2 con casa de 110m2 y terraza de 22 m, cochera de 60m2, piscina de 8. 5m de largo y 4. 5 de ancho con recinto totalmente vallada de 100 m2, zona de siembra la casa esta acondicionada con chimenea en el salón y a. c en todas las habitaciones todo el alrededor de la casa esta con cemento, banco, farolas, fuente y arboles frutales la casa se puede ver sin compromis esta ubicada a tan solo 1 km del pueblo y a unos 25 km de la capital atiendo a llamadas y correos PRECIO A COMBENIR un saludo.",Anuncio actualizado el 24 de febrero,1,0,2,0,0,segunda mano/buen estado,,no indicado,1 planta,plaza de garaje incluida en el precio,1,,,30336558, Casa o chalet independiente,,,San Bartolomé de la Torre,"Finca Agua de Verano, 4"," Finca Agua de Verano, 4 , San Bartolomé de la Torre , El Andévalo, Huelva ",,,"El Andévalo, Huelva",6153,,2019-04-13,,365000,0,4,1,1,1,
"CALLE J. REAL NAVARRO Nº 20. Vivienda adosada en zona céntrica; reformada completamente y lista para ser habitada. Planta baja: habitación de matrimonio, salón comedor, baño completo, cocina con electrodomésticos de 1ª marcas y patio exterior. Planta segunda: 2 habitaciones. Siguiente nivel amplio salón de usos múltiples con acceso a terraza exterior y buhardilla, y otro baño completo. Energía solar para agua caliente sanitaria. Ventanas climalit con mosquiteras. Splits frío/calor 1ª marcas en salones y habitaciones.",Anuncio actualizado el 12 de marzo,1,0,2,1,0,segunda mano/buen estado,,no indicado,3 plantas,,0,,,30471173, Chalet adosado,,,Minas de Riotinto,Calle J. Real Navarro s/n," Calle J. Real Navarro s/n , Minas de Riotinto , El Andévalo, Huelva ",,,"El Andévalo, Huelva",140,120,2019-04-13,sur,122000,0,4,1,0,1,
"Alonso Morgado numero 39. Casa individual con muchas posibilidades. Los suelos y los azulejos del baño y la cocina estan en perfecto estado y son blancos que no pasan de moda. La acometidas de agua y deságue están en perfecto estado. Tiene cimientos para poder construir encima. Y tiene lugar para aparcar el coche justo en frente de la puerta, cosa no muy sencilla en esta calle tan céntrica y próxima al ayuntamiento.,Tiene chimenea. una terraza para tender la ropa. Con un patio de 50 m con pozo y al fondo una habitación para trastos y otra de lavadero con la lavadora. ¿ Todo esto y así de regalado? ¿porqué se preguntarán? . Pues muy sencillo.. . porque, al no vivir cerca, no la usamos; hace 9 años que no está habitada, solo los meses de verano, y necesitaría una reforma, pero con una ligera reforma al principio, se podría vivir según se va reformando. Ideal para parejas que estén empezando. Ya que poco dinero, puede ir reformando y ampliando esta casa individual con jardin, según aumente la familia.",Anuncio actualizado el 15 de febrero,0,0,1,0,1,segunda mano/para reformar,,no indicado,1 planta,,0,,,34087453, Casa de pueblo,,,Villanueva de los Castillejos,"Calle alonso morgado, 17"," Calle alonso morgado, 17 , Villanueva de los Castillejos , El Andévalo, Huelva ",,,"El Andévalo, Huelva",108,,2019-04-13,,46000,0,2,1,0,1,
"Casa céntrica y muy luminosa, 5 habitaciones, 1 cuarto de baño, 1 aseo, salón, cocina, buhardilla, trastero espacioso, 1 salita, 1 balcón. Bien comunicada, está en pleno centro del pueblo, muy próximo a parques, Banco, principales tiendas, colegios de infantil y primaria. Desde una de las habitaciones se puede apreciar la vista al Ayuntamiento y en Enero a la Cabalgata de Reyes Magos. Al ser tan céntrica, lo principal del pueblo: bares, tiendas y demás está a menos de 10 minutos caminando. Precio a negociar.",Anuncio actualizado el 31 de marzo,0,0,2,0,0,segunda mano/buen estado,,en trámite,,,0,,,35207251, Chalet adosado,,,Minas de Riotinto,"Cervantes, 9"," Cervantes, 9 , Minas de Riotinto , El Andévalo, Huelva ",,,"El Andévalo, Huelva",180,,2019-04-13,,65000,0,5,1,0,1,
"Descripción:,FINCA TURISMO EN VALLE GRANERO CALAÑAS,Paraíso Rural entre la Montaña y las Playas de Huelva,La finca se encuentra en el Valle Granero, pleno corazón de la Comarca del Andévalo, en puertas del Parque Natural Sierra de Aracena y Picos de Aroche, término municipal de Calañas.,La finca está situada estratégicamente, cercana a todas las maravillas de la provincia de Huelva, a unos 64 km de la capital onubense, y unos 35/40 minutos de las playas.,A la finca se accede por un impresionante portón de entrada de madera de finales del siglo XVII con sus dos rosetones tallados en piedra caliza que le dan la relevancia que en su día tuvo este, también y ya en el interior de la finca se encuentran puertas, pilas y muchos objetos antiguos de gran valor que los propietarios han coleccionado y que así como el mobiliario y demás enseres quedan en la propiedad.,FINCA RURAL / CASAS RURALES,Edificio 1,Los propietarios viven en la planta superior de este edificio que cuenta con dos dormitorios, una sala de estar con cocina y una terraza. ,La recepción está en la planta baja al lado de otra estancia o zona de biblioteca para los huéspedes y un patio interior que conduce a un solárium. ,También en esta planta la casa dispone de un taller, sala de máquinas, trastero, lavandería y un pequeño apartamento para amigos o visitas, (en construcción).,Edificio 2,Este edificio es utilizado por los huéspedes. Dispone de una terraza con vistas al valle donde los huéspedes pueden relajarse y disfrutar de la tranquilidad del entorno, también lo usan los aficionados como observatorio estelar ya que al no tener contaminación lumínica es ideal para el disfrute de la noche., En la planta baja hay un gran espacio de entretenimiento con bar y chimenea también utilizado en ocasiones como sala de juntas o conferencias para sociedades o empresas; esta comunica a la par con una pequeña piscina interior climatizada o jacuzzi.,Edificio 3,Este edificio cuenta con las tres unidades de alojamientos rurales independientes con cocina. Hay espacio para 18 a 20 personas; , Los propietarios tienen los proyectos visados así como los permisos para la construcción de tres casas más, estas independientes y en zonas ya preparadas con las acometidas de agua y luz, que se pueden utilizar para aumentar el potencial de ocupación hotelera que de hecho el uso del suelo así esta calificado.,Edificio 4 (en construcción),Es un espacio salón con 3 terrazas para celebraciones y eventos para acoger a unas 300 personas, una zona interior y otra zona como terraza para disfrutar de las magníficas vistas que desde ella observamos de la sierra onubense.,En definitiva más de 500 m2 de superficie construida, casas rurales legalmente registradas, listo para que usted tome el control de un hotelito o apartamentos extra-hoteleros con cama y desayuno o como destino ideal para eventos diversos.,Especificaciones,Habitaciones………….11,Baños……………………….7,Cocinas…………………….4,Salas…………………….5,Lavandería………………...1,Sala calderas………….2,Área de Parcela………60.000 m2,Construcción……….500 m2,Piscina y porche……...250 m,Instalaciones,Áreas Comunes: Disponemos de zonas fuera de las casas de habitación como son: salón para actos varios como celebraciones o despedidas de soltera/o con chimenea, barra de bar equipo de música,etc, merendero con tres barbacoas, galería de tiro con arco 2 pistas, parque infantil, sala de juegos y biblioteca, recepción, piscina con porche y mirador a la sierra, una terraza con vistas al Valle Granero para ver bien los ciervos sobre todo en la época de la berrea o disfrutar del cielo para los aficionados al espacio ya que no tenemos contaminación lumínica alguna, espacios para mascotas, campas para otros eventos, huerto ecológico, circui.",Anuncio actualizado el 10 de abril,0,1,6,1,1,segunda mano/buen estado,2010,,2 plantas,plaza de garaje incluida en el precio,1,,calefacción central: gasoil,37899158, Cortijo,,,Calañas,Urb. Finca privada y cerrada con todos los servicios," A-478 s/n , Urb. Finca privada y cerrada con todos los servicios , Calañas , El Andévalo, Huelva ",A-478 s/n,,"El Andévalo, Huelva",60000,980,2019-04-13,"norte, sur, este, oeste",660000,1,11,1,1,1,
"Casa de planta Sevillana de tres crujías, dos patios interiores, amplia buhardilla y azotea. Reformada y en perfecto estado mantiene los elementos estructurales y ornamentales de las edificaciones de hace 100 años, muros de 60 cm de anchura y 3,20 metros de alto. Puertas originales de madera sólidas y doble hoja, revestimientos de azulejos en planta baja.,Estancias, distribuidores y habitaciones amplias, despejadas y luminosas. ,Primeras calidades en la restauración con suelo de mármol, sanitarios de cuartos de baños de 1ª.,La Casa se encuentra en el centro histórico, estando declarada entorno de bien de interés cultural.",Anuncio actualizado el 8 de abril,1,0,3,1,0,segunda mano/buen estado,,no indicado,3 plantas,,0,,,37970970, Casa o chalet independiente,,,Calañas,Urb. En la Plaza Central - Ayuntamiento," Calle Quemada, 6 , Urb. En la Plaza Central - Ayuntamiento , Calañas , El Andévalo, Huelva ","Calle Quemada, 6",,"El Andévalo, Huelva",108,216,2019-04-13,oeste,220000,0,5,0,0,1,
"Vivienda unifamiliar totalmente amueblada con mobiliario de primera calidad. Cocina totalmente equipada y prácticamente sin usar.,Planta principal. Cuatro dormitorios, salón con chimenea, comedor, sala de estar, cocina y dos cuartos de baño completos, recibidor y distribuidor. Doce espacios individuales en total.,Detalles. Solería rústica, muebles clásicos personalizados, lista para ser habitada, equipamiento en perfecto estado.,Garaje. Útil para estacionamiento de vehículo y acondicionado para servir de complemento habitable. Cuenta con cocina equipada, cuarto de baño completo, dormitorio, cuarto de trabajo y trastero amplio, además de zona de aparcamiento/tránsito.",Anuncio actualizado el 24 de marzo,0,0,3,1,0,segunda mano/buen estado,,no indicado,,plaza de garaje incluida en el precio,0,,,40302561, Casa o chalet independiente,,,Puebla de Guzman,"Barriada Santo Domingo, 12"," Barriada Santo Domingo, 12 , Puebla de Guzman , El Andévalo, Huelva ",,,"El Andévalo, Huelva",180,,2019-04-13,,180000,0,5,1,0,1,
"Chalet adosado en muy buena zona de Calañas, Huelva; orientación suroeste, iluminación natural durante todo el día, zona de aparcamiento frente al chalet, jardines y zona de parque a pocos metros del chalet, vistas desde la terraza, la cocina y dormitorios.,Fachada original conservada desde 1941, interiores reformados y remodelados desde 1996.,Perfecta para vivir, o como casa vacacional. Zona muy tranquila, vistas a dos calles, jardines y sierra natural, entrada por zona peatonal.,El chalet cuenta con 2 plantas, en la planta superior encontramos un acogedor salón, perfectamente iluminado y dos habitaciones amplias, perfectas para invitados o niños.,Ademas cuenta con una terraza y un columpio-mecedora, ideal para pasar veladas y disfrutar de las vistas.,La planta superior comunica con la planta inferior mediante una escalera que baja al patio interior, donde se encuentra un trastero y zona de barbacoa, esta distribución es ideal para poder darle intimidad por ejemplo a los invitados.,Una vez entras en la planta baja y pasas a la casa, desde el patio, encontramos un amplisimo salón, abierto, comunicado con un baño principal (muy amplio incluyendo, lavabo, videl, sanitario y bañera amplia), tres dormitorios (tamaño matrimonio), y una cocina muy amplia con zona de comedor. ,El acceso a la vivienda desde el exterior se realiza a través de la calle peatonal privada.",Anuncio actualizado el 10 de diciembre,1,0,1,1,0,segunda mano/buen estado,,en trámite,2 plantas,,0,,,40480292, Chalet adosado,,,Calañas,"Calle Manefique, 64"," Calle Manefique, 64 , Calañas , El Andévalo, Huelva ",,,"El Andévalo, Huelva",230,,2019-04-13,"sur, oeste",80000,0,5,1,0,1,
"OPORTUNIDAD! , Chalet adosado con Jardín, 4 habitaciones dobles, dos baños, terraza solarium, garaje y trastero, Reformada totalmente hace 10 años, puertas de madera, escalera de subida a segunda planta con suelo de mármol y baranda de madera, Puerta de entrada de seguridad, Ventanas de aluminio con mosquiteras y rejas de seguridad, Caseta para el perro en el Jardín, Portero automático.,La planta principal se compone de Salón comedor, Habitación doble, Baño completo con mampara de ducha, Cocina y Garaje (con luz natural a través de una claraboya), la planta de arriba se compone de 3 habitaciones, una de ellas en suite con baño completo incluido, una habitación doble con balcón y la tercera con salida a Terraza Solarium con toldo en railes. Todas las habitaciones tienen toma de televisión y teléfono. La cocina se deja amueblada con todos los electrodomésticos.",Anuncio actualizado el 23 de diciembre,0,1,2,1,0,segunda mano/buen estado,,en trámite,2 plantas,plaza de garaje incluida en el precio,0,,,81141024, Chalet adosado,,,Valverde del Camino,"Barriada Santa Cruz, 7"," Barriada Santa Cruz, 7 , Valverde del Camino , El Andévalo, Huelva ",,,"El Andévalo, Huelva",184,140,2019-04-13,sur,150000,0,4,1,0,1,
"Casa amueblada y recién rehabilitada por completo, incluyendo toda la red eléctrica y de fontanería, sita en la Sierra de Huelva (Zalamea la Real). Lista para su ocupación inmediata como vivienda habitual, como segunda residencia o como inversión para el turismo rural. Tiene 157 m2, con dos patios de estilo andaluz pavimentados y muros en su mayor parte de piedra y ladrillos antiguos que la dotan de un gran frescor natural en verano. Casi la mitad de la solería son baldosas hidráulicas artesanales y el dormitorio principal tiene techo de madera y muebles antiguos. Todas las estancias cuentan con numerosas tomas de luz (lámparas LED de última generación), telefonía y televisión, por lo que pueden convertirse en lugares de trabajo independientes en caso necesario. Dos amplias habitaciones con iluminación natural. Dos salones. Cocina nueva al estilo rústico. Dos modernos cuartos de baño. La amplia parte trasera, con salida a otra calle, se puede utilizar como almacén de desahogo o para ampliar el garaje colindante eliminando simplemente un tabique separador. Venta con descuento de casi el 20% sobre su valor objetivo.",Anuncio actualizado el 7 de abril,0,0,2,1,0,segunda mano/buen estado,,no indicado,,plaza de garaje incluida en el precio,0,,,82088029, Casa de pueblo,,,Zalamea la Real,"Calle Don Francisco Bernal, 19"," Calle Don Francisco Bernal, 19 , Zalamea la Real , El Andévalo, Huelva ",,,"El Andévalo, Huelva",157,,2019-04-13,sur,95000,0,2,1,0,0,
"Vivienda unifamiliar. Situada en localidad de la zarza (huelva), en la c/zaragoza nº 10 (cuidado, la dirección publicada es errónea). A 7 kms de las poblaciones de calañas y el cerro de andévalo. 71 m2 de superficie, construcción de 1945. Reforma de instalaciones de agua y electricidad recientes. Orientación noroeste. Consta de 2 habitaciones (ambas con ventana, pero sólo una de ellas al exterior), un salón, una salita de estar, un pequeño recibidor, un baño y una cocina completos. Fácil aparcamiento al lado de la vivienda (observar vehículo en fotos). Zona tranquila, cercana al centro de la población (menos de 1 km) para poder así acceder a todos los servicios (supermercados, tiendas, bares y restaurantes, paseo central, etc. ). La vivienda actualmente está para entrar a vivir, se dejaría amueblada. Reforma viable. Precio negociable.",Anuncio actualizado el 7 de abril,0,0,1,0,0,segunda mano/para reformar,1945,inmueble exento,bajo exterior,,0,,,82112902,Piso,,0,Calañas,"Calle Zaragoza, 2 A"," Calle Zaragoza, 2 A , Calañas , El Andévalo, Huelva ",,,"El Andévalo, Huelva",71,,2019-04-13,,25000,0,2,0,0,0,
"Se vende casa de pueblo reformada, conservando muros originales de laja. La casa dispone de dos plantas, planta principal con 4 amplias habitaciones, 2 baños completos, cocina con despensa, salón con chimenea. Planta superior totalmente diáfana con vistas al pueblo y a los alrededores. Dispone de un patio de 168 metros cuadrados con zona de huerto y porche delantero. Entorno del Andévalo de Huelva, a 49 kms de la capital y 40 kms de las zonas de playas.",Anuncio actualizado el 12 de abril,0,0,2,0,0,segunda mano/buen estado,,inmueble exento,2 plantas,,1,,,83186221, Casa o chalet independiente,,,El Almendro,"Calle Ereta, 10"," Calle Ereta, 10 , El Almendro , El Andévalo, Huelva ",,,"El Andévalo, Huelva",440,270,2019-04-13,,98000,0,4,1,0,1,
"La casa rural además de venderse también se ALQUILA. Se encuentra recién reformada. Consta de un trastero debajo de la escalera que no se aprecia en las fotos. El patio trasero tiene 30m cuadrados y la terraza de la primera planta 8m cuadrados. Los techos de la planta superior son abuhardillados y todas las ventanas tienen mosquiteras. En general podemos decir que es una casa muy amplia y luminosa. En cuanto al pueblo, tiene un hospital general, es uno de los pueblos más turísticos de la serranía de Huelva. Tiene gran variedad de emplazamientos que visitar: las cuencas mineras, el museo minero, Parque Natural Sierra de Aracena y picos de Aroche, etc. Gatronómicamente es una zona donde poder degustar los típicos productos ibéricos de la sierra. Cuenta con numerosas rutas para los amantes del senderismo, bicicletas, etc. Se encuentra cercano a la reserva animal del Castillo de las Guardas.",Anuncio actualizado el 7 de abril,1,0,2,1,1,segunda mano/buen estado,,no indicado,2 plantas,,0,,,36417856, Casa rural,,,Minas de Riotinto,"Calle Ramon y Cajal, 20"," Calle Ramon y Cajal, 20 , Minas de Riotinto , El Andévalo, Huelva ",,,"El Andévalo, Huelva",200,,2019-04-13,oeste,80000,0,4,1,0,1,
"Bonita casa de pueblo TOTALMENTE REFORMADA Y NUEVA en Nerva. Situada a 5 minutos del centro y a pocos metros de un parque infantil. La casa es muy luminosa y se encuentra en una calle ancha con fácil acceso y aparcamiento. Distribuida en dos plantas, la 2ª planta es una bonita azotea con suelo rústico y paredes con decoración de piedra.,La 1ª planta esta distribuida en dos dormitorios, salón actual y moderno con un sofá cheslong. Un cuarto de baño completo con decoración rústica y plato de ducha. Cocina totalmente amueblada en madera maciza y electrodomésticos. La vivienda tiene aire acondicionado en el salón y enchufes fontini de palometa (madera) en el cuerpo de la casa.,La casa tiene una claraboya muy luminosa. La vivienda tiene garaje amplio con puerta de metal.,El patio es muy acogedor y esta distribuido en una zona de confort y un cuartillo-lavadero. El precio es negociable y en la casa se queda el salón completo y cocina completa.",Anuncio actualizado el 7 de abril,1,0,1,0,0,segunda mano/buen estado,,en trámite,2 plantas,plaza de garaje incluida en el precio,0,,,84606734, Casa de pueblo,,,Nerva,"Calle Acije, 65"," Calle Acije, 65 , Nerva , El Andévalo, Huelva ",,,"El Andévalo, Huelva",110,80,2019-04-13,sur,78500,0,2,1,0,1,
"Magnifica casa de 1 planta en la pedanía de El Perrunal. Consta de 2 habitaciones, salón con estufa de leña, cocina amueblada, baño, dos terrazas, una de ellas se puede usar para aparcamiento. Es un pueblo muy tranquilo en la cuenca minera de Río Tinto. Tiene cerca el pantano de la Zarza, Calañas y el Cerro de Andévalo.",Anuncio actualizado el 12 de abril,1,0,1,0,0,segunda mano/buen estado,1920,en trámite,,plaza de garaje incluida en el precio,0,,,81183202, Casa o chalet,,,Calañas,," , Calañas , El Andévalo, Huelva ",,,"El Andévalo, Huelva",200,,2019-04-13,,65000,0,2,1,0,1,
"Casa adosada con 3 habitaciones en el municipio de Minas de Tharsis, en la provincia de Huelva en la calle RAMON CAJAL.",Anuncio actualizado el 27 de febrero,0,0,1,0,0,,,,,,0,,,81540352, Chalet adosado,,,Tharsis,Calle Ramon y Cajal s/n," Calle Ramon y Cajal s/n , Tharsis , El Andévalo, Huelva ",,,"El Andévalo, Huelva",81,,2019-04-13,,26750,0,3,0,0,0,
